{
  "n_cp": 8,
  "n_sp": 20,
  "params": [
    [
      0.8542,
      0.0215,
      -0.985
    ],
    [
      0.7231,
      0.154,
      -0.824
    ],
    [
      0.642,
      0.035,
      -0.785
    ],
    [
      0.5115,
      -0.042,
      -0.556
    ],
    [
      0.985,
      0.0,
      1.0
    ],
    [
      -0.354,
      0.125,
      -0.584
    ],
    [
      -0.485,
      0.015,
      -0.825
    ],
    [
      -0.592,
      -0.145,
      -0.925
    ]
  ],
  "name": "volumetric_laminar_01"
}